"supplier","country","threat_type","headline","description","source","time","diff"
"""Flarix Industries""","""China""","""port""","""Shenzhen Port Operations Slowed After Flood Damage to Transport Infrastructure""","""Flood-related damage to road and rail links near Shenzhen port has slowed container movement, leading to congestion and export backlogs. Logistics operators warn that shipment delays may continue.""","""synthetic""","1768465396678","1"
"""Stronvia Solutions""","""Poland""","""port""","""Mega £24billion airport in Europe to rival Heathrow and Dubai""","""The Centralny Port Komunikacyjny (CPK) is a £24bn airport project in Warsaw, Poland, set to open in 2032 and handle up to 44 million passengers annually as Europe's new aviation hub.""","""gnews""","1768465396678","1"
"""Axelium Works""","""Turkey""","""earthquake""","""Strong Earthquake Strikes Northwestern Turkey, Disrupting Automotive Supply Chains""","""A magnitude 6.4 earthquake struck Turkey’s Marmara region, damaging industrial facilities and halting production in multiple automotive manufacturing plants.""","""synthetic""","1768465396678","1"
"""Trevixa Enterprises""","""Bangladesh""","""strike""","""Port Workers Strike in Bangladesh Causes Export Delays""","""A strike by port workers in Dhaka and Chittagong has caused significant congestion at cargo terminals, delaying textile exports.""","""synthetic""","1768465396678","1"
"""Stronvia Solutions""","""Poland""","""port""","""Mega £24billion airport in Europe to rival Heathrow and Dubai""","""The Centralny Port Komunikacyjny (CPK) is a £24bn airport project in Warsaw, Poland, set to open in 2032 and handle up to 44 million passengers annually as Europe's new aviation hub.""","""gnews""","1768465441124","-1"
"""Axelium Works""","""Turkey""","""earthquake""","""Strong Earthquake Strikes Northwestern Turkey, Disrupting Automotive Supply Chains""","""A magnitude 6.4 earthquake struck Turkey’s Marmara region, damaging industrial facilities and halting production in multiple automotive manufacturing plants.""","""synthetic""","1768465441124","-1"
"""Trevixa Enterprises""","""Bangladesh""","""strike""","""Port Workers Strike in Bangladesh Causes Export Delays""","""A strike by port workers in Dhaka and Chittagong has caused significant congestion at cargo terminals, delaying textile exports.""","""synthetic""","1768465441124","-1"
